{
  "version": "v2",
  "name": "saas-renewal-v1",
  "description": "100 fictional existing SaaS customers for renewal-focused Arena contests. Every record carries v2 renewal fields (MRR, renewal_date, churn_risk_score, expansion_signal).",
  "synthetic": true,
  "createdAtUtc": "2026-05-18T00:00:00Z",
  "tags": [
    "saas",
    "renewal",
    "customer-success",
    "fictional"
  ],
  "leads": [
    {
      "id": "L-0001",
      "tier": "glengarry",
      "company": {
        "name": "Nimbus Ledger",
        "industry": "fintech",
        "size": "mid-market",
        "region": "us-west",
        "domain": "nimbus-ledger.example",
        "headcount": 1824
      },
      "customer_tier": "growth",
      "mrr": 41144.18,
      "renewal_date": "2026-07-10",
      "churn_risk_score": 0.79,
      "expansion_signal": [
        "usage_spike_after_board_meeting"
      ],
      "contact": {
        "firstName": "Alex",
        "lastName": "Renewal-01",
        "role": "Director of Customer Success",
        "email": "renewal.01@nimbus-ledger.example",
        "phone": "555-1001"
      },
      "signals": [
        {
          "kind": "content_engagement",
          "summary": "Opened renewal ROI deck twice this week.",
          "timestampUtc": "2026-05-10T00:00:00Z"
        }
      ],
      "notes": "High-touch renewal \u2014 contest narrators love the drama."
    },
    {
      "id": "L-0002",
      "tier": "glengarry",
      "company": {
        "name": "Patchwork HR",
        "industry": "saas",
        "size": "smb",
        "region": "emea",
        "domain": "patchwork-hr.example",
        "headcount": 7819
      },
      "customer_tier": "enterprise",
      "mrr": 94772.74,
      "renewal_date": "2026-08-22",
      "churn_risk_score": 0.52,
      "expansion_signal": [
        "seat_count_up_18pct_qoq",
        "added_second_business_unit",
        "champion_promoted_to_vp"
      ],
      "contact": {
        "firstName": "Alex",
        "lastName": "Renewal-02",
        "role": "Director of Customer Success",
        "email": "renewal.02@patchwork-hr.example",
        "phone": "555-1002"
      },
      "signals": [
        {
          "kind": "content_engagement",
          "summary": "Opened renewal ROI deck twice this week.",
          "timestampUtc": "2026-05-10T00:00:00Z"
        }
      ],
      "notes": "High-touch renewal \u2014 contest narrators love the drama."
    },
    {
      "id": "L-0003",
      "tier": "glengarry",
      "company": {
        "name": "Quill & Compass Logistics",
        "industry": "logistics",
        "size": "enterprise",
        "region": "us-west",
        "domain": "quill-compass.example",
        "headcount": 175
      },
      "customer_tier": "starter",
      "mrr": 15595.27,
      "renewal_date": "2026-09-19",
      "churn_risk_score": 0.82,
      "expansion_signal": [
        "usage_spike_after_board_meeting",
        "seat_count_up_18pct_qoq"
      ],
      "contact": {
        "firstName": "Alex",
        "lastName": "Renewal-03",
        "role": "Director of Customer Success",
        "email": "renewal.03@quill-compass.example",
        "phone": "555-1003"
      },
      "signals": [
        {
          "kind": "content_engagement",
          "summary": "Opened renewal ROI deck twice this week.",
          "timestampUtc": "2026-05-10T00:00:00Z"
        }
      ],
      "notes": "High-touch renewal \u2014 contest narrators love the drama."
    },
    {
      "id": "L-0004",
      "tier": "glengarry",
      "company": {
        "name": "Brightfolio Education",
        "industry": "education",
        "size": "mid-market",
        "region": "emea",
        "domain": "brightfolio.example",
        "headcount": 187
      },
      "customer_tier": "growth",
      "mrr": 25061.21,
      "renewal_date": "2026-06-19",
      "churn_risk_score": 0.69,
      "expansion_signal": [
        "champion_promoted_to_vp",
        "usage_spike_after_board_meeting",
        "opened_premium_analytics_trial"
      ],
      "contact": {
        "firstName": "Alex",
        "lastName": "Renewal-04",
        "role": "Director of Customer Success",
        "email": "renewal.04@brightfolio.example",
        "phone": "555-1004"
      },
      "signals": [
        {
          "kind": "content_engagement",
          "summary": "Opened renewal ROI deck twice this week.",
          "timestampUtc": "2026-05-10T00:00:00Z"
        }
      ],
      "notes": "High-touch renewal \u2014 contest narrators love the drama."
    },
    {
      "id": "L-0005",
      "tier": "glengarry",
      "company": {
        "name": "Copperline Health",
        "industry": "healthcare",
        "size": "enterprise",
        "region": "us-west",
        "domain": "copperline-health.example",
        "headcount": 7706
      },
      "customer_tier": "enterprise",
      "mrr": 89757.15,
      "renewal_date": "2026-07-31",
      "churn_risk_score": 0.69,
      "expansion_signal": [
        "champion_promoted_to_vp"
      ],
      "contact": {
        "firstName": "Alex",
        "lastName": "Renewal-05",
        "role": "Director of Customer Success",
        "email": "renewal.05@copperline-health.example",
        "phone": "555-1005"
      },
      "signals": [
        {
          "kind": "content_engagement",
          "summary": "Opened renewal ROI deck twice this week.",
          "timestampUtc": "2026-05-10T00:00:00Z"
        }
      ],
      "notes": "High-touch renewal \u2014 contest narrators love the drama."
    },
    {
      "id": "L-0006",
      "tier": "glengarry",
      "company": {
        "name": "Driftwood Media",
        "industry": "media",
        "size": "smb",
        "region": "emea",
        "domain": "driftwood-media.example",
        "headcount": 3994
      },
      "customer_tier": "starter",
      "mrr": 11886.81,
      "renewal_date": "2026-09-15",
      "churn_risk_score": 0.65,
      "expansion_signal": [
        "opened_premium_analytics_trial",
        "usage_spike_after_board_meeting",
        "added_second_business_unit"
      ],
      "contact": {
        "firstName": "Alex",
        "lastName": "Renewal-06",
        "role": "Director of Customer Success",
        "email": "renewal.06@driftwood-media.example",
        "phone": "555-1006"
      },
      "signals": [
        {
          "kind": "content_engagement",
          "summary": "Opened renewal ROI deck twice this week.",
          "timestampUtc": "2026-05-10T00:00:00Z"
        }
      ],
      "notes": "High-touch renewal \u2014 contest narrators love the drama."
    },
    {
      "id": "L-0007",
      "tier": "glengarry",
      "company": {
        "name": "Evergreen Agritech",
        "industry": "agritech",
        "size": "mid-market",
        "region": "us-west",
        "domain": "evergreen-agritech.example",
        "headcount": 4330
      },
      "customer_tier": "growth",
      "mrr": 22201.93,
      "renewal_date": "2026-07-11",
      "churn_risk_score": 0.36,
      "expansion_signal": [
        "added_second_business_unit",
        "champion_promoted_to_vp",
        "usage_spike_after_board_meeting"
      ],
      "contact": {
        "firstName": "Alex",
        "lastName": "Renewal-07",
        "role": "Director of Customer Success",
        "email": "renewal.07@evergreen-agritech.example",
        "phone": "555-1007"
      },
      "signals": [
        {
          "kind": "content_engagement",
          "summary": "Opened renewal ROI deck twice this week.",
          "timestampUtc": "2026-05-10T00:00:00Z"
        }
      ],
      "notes": "High-touch renewal \u2014 contest narrators love the drama."
    },
    {
      "id": "L-0008",
      "tier": "glengarry",
      "company": {
        "name": "Fable Street Commerce",
        "industry": "ecommerce",
        "size": "smb",
        "region": "emea",
        "domain": "fable-street.example",
        "headcount": 2302
      },
      "customer_tier": "enterprise",
      "mrr": 69283.14,
      "renewal_date": "2026-09-23",
      "churn_risk_score": 0.35,
      "expansion_signal": [
        "opened_premium_analytics_trial",
        "seat_count_up_18pct_qoq"
      ],
      "contact": {
        "firstName": "Alex",
        "lastName": "Renewal-08",
        "role": "Director of Customer Success",
        "email": "renewal.08@fable-street.example",
        "phone": "555-1008"
      },
      "signals": [
        {
          "kind": "content_engagement",
          "summary": "Opened renewal ROI deck twice this week.",
          "timestampUtc": "2026-05-10T00:00:00Z"
        }
      ],
      "notes": "High-touch renewal \u2014 contest narrators love the drama."
    },
    {
      "id": "L-0009",
      "tier": "glengarry",
      "company": {
        "name": "Harborview Hospitality",
        "industry": "hospitality",
        "size": "mid-market",
        "region": "us-west",
        "domain": "harborview-hosp.example",
        "headcount": 7092
      },
      "customer_tier": "starter",
      "mrr": 34264.34,
      "renewal_date": "2026-08-23",
      "churn_risk_score": 0.85,
      "expansion_signal": [
        "added_second_business_unit"
      ],
      "contact": {
        "firstName": "Alex",
        "lastName": "Renewal-09",
        "role": "Director of Customer Success",
        "email": "renewal.09@harborview-hosp.example",
        "phone": "555-1009"
      },
      "signals": [
        {
          "kind": "content_engagement",
          "summary": "Opened renewal ROI deck twice this week.",
          "timestampUtc": "2026-05-10T00:00:00Z"
        }
      ],
      "notes": "High-touch renewal \u2014 contest narrators love the drama."
    },
    {
      "id": "L-0010",
      "tier": "glengarry",
      "company": {
        "name": "Ironclad Manufacturing",
        "industry": "manufacturing",
        "size": "enterprise",
        "region": "emea",
        "domain": "ironclad-mfg.example",
        "headcount": 3212
      },
      "customer_tier": "growth",